{
  "name": "glean-dev-docs",
  "displayName": "Glean Developer Docs",
  "version": "3.6.0",
  "description": "Search the public Glean developer documentation — APIs, SDKs, MCP, and integration guides for building with Glean.",
  "author": {
    "name": "Glean",
    "email": "steve.calvert@glean.com",
    "url": "https://glean.com"
  },
  "homepage": "https://docs.glean.com/administration/platform/mcp/about",
  "repository": "https://github.com/gleanwork/agent-plugins",
  "license": "MIT",
  "skills": "./skills/"
}
