{
  "name": "glean-search",
  "displayName": "Glean Search",
  "version": "0.1.0",
  "description": "Enterprise search across documents, Slack, email, and other sources via Glean.",
  "author": {
    "name": "Glean",
    "email": "steve.calvert@glean.com"
  },
  "homepage": "https://docs.glean.com/administration/platform/mcp/about",
  "repository": "https://github.com/gleanwork/cursor-plugins",
  "license": "MIT",
  "logo": "assets/avatar.svg",
  "keywords": ["glean", "search", "enterprise", "documents"],
  "category": "developer-tools",
  "tags": ["search", "documents", "slack", "email"],
  "skills": "./skills/",
  "agents": "./agents/"
}
