{
  "name": "glean-core",
  "displayName": "Glean Core",
  "version": "0.1.0",
  "description": "Core Glean MCP integration â€” shared skills, tool guidance, and rules. Required foundation for all other Glean plugins.",
  "author": {
    "name": "Glean",
    "email": "steve.calvert@glean.com"
  },
  "publisher": "Glean",
  "homepage": "https://docs.glean.com/administration/platform/mcp/about",
  "repository": "https://github.com/gleanwork/cursor-plugins",
  "license": "MIT",
  "logo": "assets/avatar.png",
  "keywords": ["glean", "mcp", "enterprise-search", "core"],
  "category": "developer-tools",
  "tags": ["mcp", "enterprise", "search", "foundation"],
  "skills": "./skills/",
  "rules": "./rules/"
}
