{
  "name": "glean-code",
  "displayName": "Glean Code",
  "version": "0.1.0",
  "description": "Cross-repository code exploration â€” search code across your org, find examples, and discover similar implementations.",
  "author": {
    "name": "Glean",
    "email": "steve.calvert@glean.com"
  },
  "homepage": "https://docs.glean.com/administration/platform/mcp/about",
  "repository": "https://github.com/gleanwork/cursor-plugins",
  "license": "MIT",
  "logo": "assets/avatar.svg",
  "keywords": ["glean", "code-search", "cross-repo", "engineering"],
  "category": "developer-tools",
  "tags": ["code", "search", "architecture", "planning"],
  "skills": "./skills/",
  "agents": "./agents/"
}
