{
  "name": "glean-people",
  "displayName": "Glean People",
  "version": "1.0.0",
  "description": "Find experts, understand org structure, and identify stakeholders via Glean.",
  "author": {
    "name": "Glean",
    "email": "steve.calvert@glean.com"
  },
  "homepage": "https://docs.glean.com/administration/platform/mcp/about",
  "repository": "https://github.com/gleanwork/cursor-plugins",
  "license": "MIT",
  "logo": "assets/avatar.svg",
  "keywords": [
    "glean",
    "people",
    "experts",
    "org-chart"
  ],
  "category": "developer-tools",
  "tags": [
    "people",
    "experts",
    "stakeholders",
    "org"
  ],
  "skills": "./skills/",
  "agents": "./agents/"
}
